<?xml version="1.0" encoding="UTF-8"?>
<!-- configuration for aSAPXcess SAP adapter for jboss 3.2 -->
<!-- ==================================================================== -->
<!-- aSAPXcess adapter configuration for SAP R3 -->
<!-- Contact: aif_support@asapsolutions.com -->
<!-- -->
<!-- ==================================================================== -->
<resource-adapter xmlns:xsi="http://www.w3.org/2001/XMLSchema-instance" xsi:noNamespaceSchemaLocation="../../../main/resources/schema/resource-adapter_1_0.xsd">
  <archive>token</archive>
  <transaction-support>NoTransaction</transaction-support>
  <local-tx-connection-factory class-name="token" enabled="true" jndi-name="aSAPXcess"
    pool-name="aSAPXcess">
    <min-pool-size>0</min-pool-size>
    <max-pool-size>64</max-pool-size>
    <config-property name="LogConfigFile" >ASAP_SAP_1_0.xml</config-property>
    <config-property name="RootLogContext" >ASAP_SAP_1_0</config-property>
    <config-property name="LogLevel" >WARN</config-property>
    <config-property name="MessageBundleBase" >ASAP_SAP_1_0</config-property>
    <config-property name="LanguageCode" >en</config-property>
    <config-property name="CountryCode" >US</config-property>
    <config-property name="UserName" ></config-property>
    <config-property name="Password" ></config-property>
    <config-property name="ClientNumber" ></config-property>
    <config-property name="ServerName" ></config-property>
    <config-property name="SystemNumber" ></config-property>
    <config-property name="GatewayServerName" ></config-property>
    <config-property name="GatewayServiceNumber" ></config-property>
    <config-property name="SystemName" ></config-property>
    <config-property name="MessageServerName" ></config-property>
    <config-property name="GroupName" ></config-property>
    <config-property name="ConnectionURL" ></config-property>
    <security>
      <security-manager>APPLICATION</security-manager>
      <!-- If you supply the usr/pw from a JAAS login module -->
      <security-domain>MySecurityDomain</security-domain>
    </security>
    <time-out>
      <blocking-timeout-millis>5000</blocking-timeout-millis>
      <idle-timeout-minutes>15</idle-timeout-minutes>
    </time-out>
  </local-tx-connection-factory>
  <admin-object class-name="token" enabled="true" jndi-name="token" use-java-context="false">
    <config-property name="token" />
  </admin-object>
</resource-adapter>
